{"campaign_id":"campaign-02","certified_plan_bindings":[{"arm_id":"sha256:db0407e024443ea5e9b27d88941577b5f6ef4e5ac67cd3fcc7cc69a756701c94","arm_name":"flat-embedded","gate_stage":"STAGE_A_EXACTNESS","policy":{"accumulator_proof_id":"sha256:4e79a87aa6524049f544cb235255af3aa38630ab8f2427455884d1618999e329","apply_arithmetic_profile_id":"sha256:2ba82c5f03caa33c68eddc3b5acb5337bba8e45a0d6bbc4224b3dea67d86e97e","arithmetic_profile_id":"sha256:006158cb488111f371a8143af4801557c6fa54fa5e7f98f8d648ad5ff8c6044b","height":1,"parameter_schema_id":"sha256:56b99f18581960a30c41d8c0b9bcd0c93ea2063dfc0d11dd6fa9b611e52b572e","quorum_threshold":3,"required_shards":[{"domain_id":"wikitext-en","shard_id":"adapter-shard-0"}],"round_config_id":"sha256:13f8cc64327d3b5470d1cf8eb31f8b23f63ac7e47b67c8aec57d4bc39484831b","round_id":"campaign-02:STAGE_A_EXACTNESS:flat-embedded:1:2026090101","validator_epoch_id":"sha256:8b5cd919614eb9a4229b6bd8a3c103cc3023bd062941b1f8b7fa29fc32b9c07e","validator_ids":["runtime-validator-0","runtime-validator-1","runtime-validator-2","runtime-validator-3"],"view":0},"repetition":1,"seed":2026090101},{"arm_id":"sha256:db0407e024443ea5e9b27d88941577b5f6ef4e5ac67cd3fcc7cc69a756701c94","arm_name":"flat-embedded","gate_stage":"STAGE_A_EXACTNESS","policy":{"accumulator_proof_id":"sha256:4e79a87aa6524049f544cb235255af3aa38630ab8f2427455884d1618999e329","apply_arithmetic_profile_id":"sha256:2ba82c5f03caa33c68eddc3b5acb5337bba8e45a0d6bbc4224b3dea67d86e97e","arithmetic_profile_id":"sha256:006158cb488111f371a8143af4801557c6fa54fa5e7f98f8d648ad5ff8c6044b","height":1,"parameter_schema_id":"sha256:56b99f18581960a30c41d8c0b9bcd0c93ea2063dfc0d11dd6fa9b611e52b572e","quorum_threshold":3,"required_shards":[{"domain_id":"wikitext-en","shard_id":"adapter-shard-0"}],"round_config_id":"sha256:20d057b8cda085c76b29a06a0d203f7f767f73c0856f31313b587edc3c0c01db","round_id":"campaign-02:STAGE_A_EXACTNESS:flat-embedded:2:2026090102","validator_epoch_id":"sha256:8b5cd919614eb9a4229b6bd8a3c103cc3023bd062941b1f8b7fa29fc32b9c07e","validator_ids":["runtime-validator-0","runtime-validator-1","runtime-validator-2","runtime-validator-3"],"view":0},"repetition":2,"seed":2026090102},{"arm_id":"sha256:db0407e024443ea5e9b27d88941577b5f6ef4e5ac67cd3fcc7cc69a756701c94","arm_name":"flat-embedded","gate_stage":"STAGE_A_EXACTNESS","policy":{"accumulator_proof_id":"sha256:4e79a87aa6524049f544cb235255af3aa38630ab8f2427455884d1618999e329","apply_arithmetic_profile_id":"sha256:2ba82c5f03caa33c68eddc3b5acb5337bba8e45a0d6bbc4224b3dea67d86e97e","arithmetic_profile_id":"sha256:006158cb488111f371a8143af4801557c6fa54fa5e7f98f8d648ad5ff8c6044b","height":1,"parameter_schema_id":"sha256:56b99f18581960a30c41d8c0b9bcd0c93ea2063dfc0d11dd6fa9b611e52b572e","quorum_threshold":3,"required_shards":[{"domain_id":"wikitext-en","shard_id":"adapter-shard-0"}],"round_config_id":"sha256:2085cc81cd4b592ab7b92aca4b824d6abcf642cd2ea30760a0eab40752970d8a","round_id":"campaign-02:STAGE_A_EXACTNESS:flat-embedded:3:2026090103","validator_epoch_id":"sha256:8b5cd919614eb9a4229b6bd8a3c103cc3023bd062941b1f8b7fa29fc32b9c07e","validator_ids":["runtime-validator-0","runtime-validator-1","runtime-validator-2","runtime-validator-3"],"view":0},"repetition":3,"seed":2026090103},{"arm_id":"sha256:dd19e21516f4a9289816c3e99db3860fd52e32375c1489fc9bf49ff96e426cab","arm_name":"flat-sidecar","gate_stage":"STAGE_A_EXACTNESS","policy":{"accumulator_proof_id":"sha256:4e79a87aa6524049f544cb235255af3aa38630ab8f2427455884d1618999e329","apply_arithmetic_profile_id":"sha256:2ba82c5f03caa33c68eddc3b5acb5337bba8e45a0d6bbc4224b3dea67d86e97e","arithmetic_profile_id":"sha256:006158cb488111f371a8143af4801557c6fa54fa5e7f98f8d648ad5ff8c6044b","height":1,"parameter_schema_id":"sha256:56b99f18581960a30c41d8c0b9bcd0c93ea2063dfc0d11dd6fa9b611e52b572e","quorum_threshold":3,"required_shards":[{"domain_id":"wikitext-en","shard_id":"adapter-shard-0"}],"round_config_id":"sha256:83587bdfcd407bc7f6c78ce2bc9076526258fd023c20ddf084580888f588d84d","round_id":"campaign-02:STAGE_A_EXACTNESS:flat-sidecar:1:2026090101","validator_epoch_id":"sha256:8b5cd919614eb9a4229b6bd8a3c103cc3023bd062941b1f8b7fa29fc32b9c07e","validator_ids":["runtime-validator-0","runtime-validator-1","runtime-validator-2","runtime-validator-3"],"view":0},"repetition":1,"seed":2026090101},{"arm_id":"sha256:dd19e21516f4a9289816c3e99db3860fd52e32375c1489fc9bf49ff96e426cab","arm_name":"flat-sidecar","gate_stage":"STAGE_A_EXACTNESS","policy":{"accumulator_proof_id":"sha256:4e79a87aa6524049f544cb235255af3aa38630ab8f2427455884d1618999e329","apply_arithmetic_profile_id":"sha256:2ba82c5f03caa33c68eddc3b5acb5337bba8e45a0d6bbc4224b3dea67d86e97e","arithmetic_profile_id":"sha256:006158cb488111f371a8143af4801557c6fa54fa5e7f98f8d648ad5ff8c6044b","height":1,"parameter_schema_id":"sha256:56b99f18581960a30c41d8c0b9bcd0c93ea2063dfc0d11dd6fa9b611e52b572e","quorum_threshold":3,"required_shards":[{"domain_id":"wikitext-en","shard_id":"adapter-shard-0"}],"round_config_id":"sha256:ebd1104a3c98b435e073ad89329a1bbb0305dbf14048ade2a32070f10838b8de","round_id":"campaign-02:STAGE_A_EXACTNESS:flat-sidecar:2:2026090102","validator_epoch_id":"sha256:8b5cd919614eb9a4229b6bd8a3c103cc3023bd062941b1f8b7fa29fc32b9c07e","validator_ids":["runtime-validator-0","runtime-validator-1","runtime-validator-2","runtime-validator-3"],"view":0},"repetition":2,"seed":2026090102},{"arm_id":"sha256:dd19e21516f4a9289816c3e99db3860fd52e32375c1489fc9bf49ff96e426cab","arm_name":"flat-sidecar","gate_stage":"STAGE_A_EXACTNESS","policy":{"accumulator_proof_id":"sha256:4e79a87aa6524049f544cb235255af3aa38630ab8f2427455884d1618999e329","apply_arithmetic_profile_id":"sha256:2ba82c5f03caa33c68eddc3b5acb5337bba8e45a0d6bbc4224b3dea67d86e97e","arithmetic_profile_id":"sha256:006158cb488111f371a8143af4801557c6fa54fa5e7f98f8d648ad5ff8c6044b","height":1,"parameter_schema_id":"sha256:56b99f18581960a30c41d8c0b9bcd0c93ea2063dfc0d11dd6fa9b611e52b572e","quorum_threshold":3,"required_shards":[{"domain_id":"wikitext-en","shard_id":"adapter-shard-0"}],"round_config_id":"sha256:2511a48b49691a1cb9272196a503a38995b158d131095f072daf43f036727934","round_id":"campaign-02:STAGE_A_EXACTNESS:flat-sidecar:3:2026090103","validator_epoch_id":"sha256:8b5cd919614eb9a4229b6bd8a3c103cc3023bd062941b1f8b7fa29fc32b9c07e","validator_ids":["runtime-validator-0","runtime-validator-1","runtime-validator-2","runtime-validator-3"],"view":0},"repetition":3,"seed":2026090103},{"arm_id":"sha256:1ad76bc3613e39c324a318f8c44fd3b8c3ef157c7d5d6615a99e2e4ca1ded674","arm_name":"hierarchy-embedded","gate_stage":"STAGE_A_EXACTNESS","policy":{"accumulator_proof_id":"sha256:4e79a87aa6524049f544cb235255af3aa38630ab8f2427455884d1618999e329","apply_arithmetic_profile_id":"sha256:2ba82c5f03caa33c68eddc3b5acb5337bba8e45a0d6bbc4224b3dea67d86e97e","arithmetic_profile_id":"sha256:006158cb488111f371a8143af4801557c6fa54fa5e7f98f8d648ad5ff8c6044b","height":1,"parameter_schema_id":"sha256:56b99f18581960a30c41d8c0b9bcd0c93ea2063dfc0d11dd6fa9b611e52b572e","quorum_threshold":3,"required_shards":[{"domain_id":"wikitext-en","shard_id":"adapter-shard-0"}],"round_config_id":"sha256:8ba9f46cee28000d33683d39ec35157407f42b833c482880532c622b07f4ab05","round_id":"campaign-02:STAGE_A_EXACTNESS:hierarchy-embedded:1:2026090101","validator_epoch_id":"sha256:8b5cd919614eb9a4229b6bd8a3c103cc3023bd062941b1f8b7fa29fc32b9c07e","validator_ids":["runtime-validator-0","runtime-validator-1","runtime-validator-2","runtime-validator-3"],"view":0},"repetition":1,"seed":2026090101},{"arm_id":"sha256:1ad76bc3613e39c324a318f8c44fd3b8c3ef157c7d5d6615a99e2e4ca1ded674","arm_name":"hierarchy-embedded","gate_stage":"STAGE_A_EXACTNESS","policy":{"accumulator_proof_id":"sha256:4e79a87aa6524049f544cb235255af3aa38630ab8f2427455884d1618999e329","apply_arithmetic_profile_id":"sha256:2ba82c5f03caa33c68eddc3b5acb5337bba8e45a0d6bbc4224b3dea67d86e97e","arithmetic_profile_id":"sha256:006158cb488111f371a8143af4801557c6fa54fa5e7f98f8d648ad5ff8c6044b","height":1,"parameter_schema_id":"sha256:56b99f18581960a30c41d8c0b9bcd0c93ea2063dfc0d11dd6fa9b611e52b572e","quorum_threshold":3,"required_shards":[{"domain_id":"wikitext-en","shard_id":"adapter-shard-0"}],"round_config_id":"sha256:7f3ba707ad6f0f982f0c6a0a53742e5f1968bdfa0e7c60fb22ad66b782722a1d","round_id":"campaign-02:STAGE_A_EXACTNESS:hierarchy-embedded:2:2026090102","validator_epoch_id":"sha256:8b5cd919614eb9a4229b6bd8a3c103cc3023bd062941b1f8b7fa29fc32b9c07e","validator_ids":["runtime-validator-0","runtime-validator-1","runtime-validator-2","runtime-validator-3"],"view":0},"repetition":2,"seed":2026090102},{"arm_id":"sha256:1ad76bc3613e39c324a318f8c44fd3b8c3ef157c7d5d6615a99e2e4ca1ded674","arm_name":"hierarchy-embedded","gate_stage":"STAGE_A_EXACTNESS","policy":{"accumulator_proof_id":"sha256:4e79a87aa6524049f544cb235255af3aa38630ab8f2427455884d1618999e329","apply_arithmetic_profile_id":"sha256:2ba82c5f03caa33c68eddc3b5acb5337bba8e45a0d6bbc4224b3dea67d86e97e","arithmetic_profile_id":"sha256:006158cb488111f371a8143af4801557c6fa54fa5e7f98f8d648ad5ff8c6044b","height":1,"parameter_schema_id":"sha256:56b99f18581960a30c41d8c0b9bcd0c93ea2063dfc0d11dd6fa9b611e52b572e","quorum_threshold":3,"required_shards":[{"domain_id":"wikitext-en","shard_id":"adapter-shard-0"}],"round_config_id":"sha256:1728259b4799dfec739cfb4b4434547eb7a32cce9ebc2ac18eb10ea272f2d599","round_id":"campaign-02:STAGE_A_EXACTNESS:hierarchy-embedded:3:2026090103","validator_epoch_id":"sha256:8b5cd919614eb9a4229b6bd8a3c103cc3023bd062941b1f8b7fa29fc32b9c07e","validator_ids":["runtime-validator-0","runtime-validator-1","runtime-validator-2","runtime-validator-3"],"view":0},"repetition":3,"seed":2026090103},{"arm_id":"sha256:70bb68bc911cd83de968c4baf158b040d9e057cb1ecdfce776cbb405bce133f3","arm_name":"hierarchy-sidecar","gate_stage":"STAGE_A_EXACTNESS","policy":{"accumulator_proof_id":"sha256:4e79a87aa6524049f544cb235255af3aa38630ab8f2427455884d1618999e329","apply_arithmetic_profile_id":"sha256:2ba82c5f03caa33c68eddc3b5acb5337bba8e45a0d